{
  "capture_id": "1a8384c3f6",
  "tier": "lidar",
  "rooms": [
    {
      "room_id": "room1",
      "walls": [
        {
          "start": [
            -6.793236311389342,
            -1.2069664198562178
          ],
          "end": [
            -6.793236311389342,
            1.8430335801437172
          ],
          "length_m": {
            "value": 3.049999999999935,
            "lo": 3.018991666666602,
            "hi": 3.081008333333268,
            "unit": "m",
            "level": 0.9
          }
        },
        {
          "start": [
            -6.793236311389342,
            1.8430335801437172
          ],
          "end": [
            -3.7832363113894063,
            1.8430335801437172
          ],
          "length_m": {
            "value": 3.009999999999936,
            "lo": 2.961681578947305,
            "hi": 3.0583184210525665,
            "unit": "m",
            "level": 0.9
          }
        },
        {
          "start": [
            -3.7832363113894063,
            1.8430335801437172
          ],
          "end": [
            -3.7832363113894063,
            -1.2069664198562178
          ],
          "length_m": {
            "value": 3.049999999999935,
            "lo": 3.0194999999999355,
            "hi": 3.0804999999999345,
            "unit": "m",
            "level": 0.9
          }
        },
        {
          "start": [
            -3.7832363113894063,
            -1.2069664198562178
          ],
          "end": [
            -6.793236311389342,
            -1.2069664198562178
          ],
          "length_m": {
            "value": 3.009999999999936,
            "lo": 2.954360606060543,
            "hi": 3.0656393939393287,
            "unit": "m",
            "level": 0.9
          }
        }
      ],
      "ceiling_height_m": null,
      "floor_area_m2": {
        "value": 9.180499999999608,
        "lo": 8.996889999999615,
        "hi": 9.3641099999996,
        "unit": "m2",
        "level": 0.9
      },
      "openings": [],
      "damage": [],
      "concealed_flags": [],
      "scope": [],
      "origin_xy": [
        0.0,
        0.0
      ],
      "rotation_deg": 0.0
    },
    {
      "room_id": "room2",
      "walls": [
        {
          "start": [
            0.06604942492428978,
            0.03913854029249997
          ],
          "end": [
            0.06604942492428978,
            2.5891385402925025
          ],
          "length_m": {
            "value": 2.5500000000000025,
            "lo": 2.480210526315792,
            "hi": 2.619789473684213,
            "unit": "m",
            "level": 0.9
          }
        },
        {
          "start": [
            0.06604942492428978,
            2.5891385402925025
          ],
          "end": [
            2.326049424924292,
            2.5891385402925025
          ],
          "length_m": {
            "value": 2.2600000000000025,
            "lo": 2.2214962962962987,
            "hi": 2.298503703703706,
            "unit": "m",
            "level": 0.9
          }
        },
        {
          "start": [
            2.326049424924292,
            2.5891385402925025
          ],
          "end": [
            2.326049424924292,
            0.03913854029249997
          ],
          "length_m": {
            "value": 2.5500000000000025,
            "lo": 2.4947500000000025,
            "hi": 2.6052500000000025,
            "unit": "m",
            "level": 0.9
          }
        },
        {
          "start": [
            2.326049424924292,
            0.03913854029249997
          ],
          "end": [
            0.06604942492428978,
            0.03913854029249997
          ],
          "length_m": {
            "value": 2.2600000000000025,
            "lo": 2.2340100000000023,
            "hi": 2.2859900000000026,
            "unit": "m",
            "level": 0.9
          }
        }
      ],
      "ceiling_height_m": null,
      "floor_area_m2": {
        "value": 5.7630000000000114,
        "lo": 5.647740000000011,
        "hi": 5.878260000000012,
        "unit": "m2",
        "level": 0.9
      },
      "openings": [],
      "damage": [],
      "concealed_flags": [],
      "scope": [],
      "origin_xy": [
        0.0,
        0.0
      ],
      "rotation_deg": 0.0
    },
    {
      "room_id": "room3",
      "walls": [
        {
          "start": [
            -3.6047033660007735,
            0.5976381383329882
          ],
          "end": [
            -3.6047033660007735,
            3.547638138332991
          ],
          "length_m": {
            "value": 2.950000000000003,
            "lo": 2.91839285714286,
            "hi": 2.9816071428571456,
            "unit": "m",
            "level": 0.9
          }
        },
        {
          "start": [
            -3.6047033660007735,
            3.547638138332991
          ],
          "end": [
            -4.949372021361629,
            3.547638138332991
          ],
          "length_m": {
            "value": 1.3446686553608558,
            "lo": 1.3116631520019983,
            "hi": 1.3776741587197132,
            "unit": "m",
            "level": 0.9
          }
        },
        {
          "start": [
            -4.949372021361629,
            3.547638138332991
          ],
          "end": [
            -4.949372021361629,
            4.557638138332991
          ],
          "length_m": {
            "value": 1.0100000000000002,
            "lo": 0.9426666666666669,
            "hi": 1.0773333333333335,
            "unit": "m",
            "level": 0.9
          }
        },
        {
          "start": [
            -4.949372021361629,
            4.557638138332991
          ],
          "end": [
            -3.6047033660007735,
            4.557638138332991
          ],
          "length_m": {
            "value": 1.3446686553608558,
            "lo": 1.2550240783367987,
            "hi": 1.4343132323849128,
            "unit": "m",
            "level": 0.9
          }
        },
        {
          "start": [
            -3.6047033660007735,
            4.557638138332991
          ],
          "end": [
            -3.6047033660007735,
            4.367638138332992
          ],
          "length_m": {
            "value": 0.1899999999999995,
            "lo": 0.17733333333333287,
            "hi": 0.20266666666666613,
            "unit": "m",
            "level": 0.9
          }
        },
        {
          "start": [
            -3.6047033660007735,
            4.367638138332992
          ],
          "end": [
            -0.7547033660008342,
            4.367638138332992
          ],
          "length_m": {
            "value": 2.8499999999999392,
            "lo": 2.6599999999999433,
            "hi": 3.039999999999935,
            "unit": "m",
            "level": 0.9
          }
        },
        {
          "start": [
            -0.7547033660008342,
            4.367638138332992
          ],
          "end": [
            -0.7547033660008342,
            0.5976381383329882
          ],
          "length_m": {
            "value": 3.7700000000000036,
            "lo": 3.7259200000000035,
            "hi": 3.8140800000000037,
            "unit": "m",
            "level": 0.9
          }
        },
        {
          "start": [
            -0.7547033660008342,
            0.5976381383329882
          ],
          "end": [
            -3.6047033660007735,
            0.5976381383329882
          ],
          "length_m": {
            "value": 2.8499999999999392,
            "lo": 2.79584999999994,
            "hi": 2.9041499999999383,
            "unit": "m",
            "level": 0.9
          }
        }
      ],
      "ceiling_height_m": null,
      "floor_area_m2": {
        "value": 12.102615341914252,
        "lo": 11.860563035075966,
        "hi": 12.344667648752537,
        "unit": "m2",
        "level": 0.9
      },
      "openings": [],
      "damage": [],
      "concealed_flags": [],
      "scope": [],
      "origin_xy": [
        0.0,
        0.0
      ],
      "rotation_deg": 0.0
    },
    {
      "room_id": "room4",
      "walls": [
        {
          "start": [
            -6.431772369978485,
            2.7260533942758842
          ],
          "end": [
            -6.431772369978485,
            4.9160533942758855
          ],
          "length_m": {
            "value": 2.1900000000000013,
            "lo": 2.102400000000001,
            "hi": 2.2776000000000014,
            "unit": "m",
            "level": 0.9
          }
        },
        {
          "start": [
            -6.431772369978485,
            4.9160533942758855
          ],
          "end": [
            -5.151772369978512,
            4.9160533942758855
          ],
          "length_m": {
            "value": 1.2799999999999727,
            "lo": 1.264152380952354,
            "hi": 1.2958476190475914,
            "unit": "m",
            "level": 0.9
          }
        },
        {
          "start": [
            -5.151772369978512,
            4.9160533942758855
          ],
          "end": [
            -5.151772369978512,
            2.7260533942758842
          ],
          "length_m": {
            "value": 2.1900000000000013,
            "lo": 2.1555857142857153,
            "hi": 2.2244142857142872,
            "unit": "m",
            "level": 0.9
          }
        },
        {
          "start": [
            -5.151772369978512,
            2.7260533942758842
          ],
          "end": [
            -6.431772369978485,
            2.7260533942758842
          ],
          "length_m": {
            "value": 1.2799999999999727,
            "lo": 1.2604235294117379,
            "hi": 1.2995764705882076,
            "unit": "m",
            "level": 0.9
          }
        }
      ],
      "ceiling_height_m": null,
      "floor_area_m2": {
        "value": 2.80319999999994,
        "lo": 2.747135999999941,
        "hi": 2.8592639999999387,
        "unit": "m2",
        "level": 0.9
      },